{
  "gameVersion": "WH3 Steam build 24237342",
  "campaign": "wh3_main_combi",
  "generatedAt": "2026-09-02T17:12:35.052631+00:00",
  "relations": [
    {
      "sourceFaction": "wh3_dlc20_chs_festus",
      "targetFaction": "wh_main_emp_hochland",
      "baseAttitude": null,
      "modifiers": [],
      "treaties": [],
      "atWar": true
    },
    {
      "sourceFaction": "wh3_main_skv_clan_gritus",
      "targetFaction": "wh3_main_ksl_brotherhood_of_the_bear",
      "baseAttitude": null,
      "modifiers": [],
      "treaties": [],
      "atWar": true
    },
    {
      "sourceFaction": "wh_main_emp_ostland",
      "targetFaction": "wh_main_emp_nordland",
      "baseAttitude": null,
      "modifiers": [],
      "treaties": [],
      "atWar": true
    },
    {
      "sourceFaction": "wh_main_emp_ostland",
      "targetFaction": "wh_main_emp_ostermark",
      "baseAttitude": null,
      "modifiers": [],
      "treaties": [],
      "atWar": false
    },
    {
      "sourceFaction": "wh2_main_skv_clan_mors",
      "targetFaction": "wh_main_grn_red_fangs",
      "baseAttitude": null,
      "modifiers": [],
      "treaties": [],
      "atWar": true
    },
    {
      "sourceFaction": "wh2_main_skv_clan_mors",
      "targetFaction": "wh_main_grn_necksnappers",
      "baseAttitude": null,
      "modifiers": [],
      "treaties": [],
      "atWar": true
    },
    {
      "sourceFaction": "wh2_main_skv_clan_mors",
      "targetFaction": "wh2_main_vmp_the_silver_host",
      "baseAttitude": null,
      "modifiers": [],
      "treaties": [
        "non_aggression_pact"
      ],
      "atWar": false
    },
    {
      "sourceFaction": "wh2_dlc09_tmb_followers_of_nagash",
      "targetFaction": "wh2_dlc11_cst_vampire_coast",
      "baseAttitude": null,
      "modifiers": [],
      "treaties": [
        "non_aggression_pact"
      ],
      "atWar": false
    },
    {
      "sourceFaction": "wh2_dlc09_tmb_followers_of_nagash",
      "targetFaction": "wh2_main_brt_knights_of_the_flame",
      "baseAttitude": null,
      "modifiers": [],
      "treaties": [],
      "atWar": true
    },
    {
      "sourceFaction": "wh3_main_dae_daemon_prince",
      "targetFaction": "wh3_main_tze_all_seeing_eye",
      "baseAttitude": null,
      "modifiers": [],
      "treaties": [],
      "atWar": true
    },
    {
      "sourceFaction": "wh3_main_cth_the_western_provinces",
      "targetFaction": "wh3_main_cth_dissenter_lords_of_jinshen",
      "baseAttitude": null,
      "modifiers": [],
      "treaties": [],
      "atWar": true
    },
    {
      "sourceFaction": "wh3_main_cth_the_western_provinces",
      "targetFaction": "wh2_main_skv_clan_eshin",
      "baseAttitude": null,
      "modifiers": [],
      "treaties": [],
      "atWar": true
    },
    {
      "sourceFaction": "wh_main_grn_teef_snatchaz",
      "targetFaction": "wh3_main_skv_clan_verms",
      "baseAttitude": null,
      "modifiers": [],
      "treaties": [],
      "atWar": true
    },
    {
      "sourceFaction": "wh3_dlc24_tze_the_deceivers",
      "targetFaction": "wh_dlc03_grn_black_pit",
      "baseAttitude": null,
      "modifiers": [],
      "treaties": [
        "non_aggression_pact"
      ],
      "atWar": false
    },
    {
      "sourceFaction": "wh3_dlc24_tze_the_deceivers",
      "targetFaction": "wh_main_emp_nordland",
      "baseAttitude": null,
      "modifiers": [],
      "treaties": [],
      "atWar": true
    },
    {
      "sourceFaction": "wh_main_grn_red_eye",
      "targetFaction": "wh_main_dwf_zhufbar",
      "baseAttitude": null,
      "modifiers": [],
      "treaties": [],
      "atWar": true
    },
    {
      "sourceFaction": "wh_main_grn_red_eye",
      "targetFaction": "wh_main_dwf_karak_kadrin",
      "baseAttitude": null,
      "modifiers": [],
      "treaties": [],
      "atWar": true
    },
    {
      "sourceFaction": "wh3_main_cth_dissenter_lords_of_jinshen",
      "targetFaction": "wh3_main_cth_rebel_lords_of_nan_yang",
      "baseAttitude": null,
      "modifiers": [],
      "treaties": [
        "military_access",
        "non_aggression_pact"
      ],
      "atWar": false
    },
    {
      "sourceFaction": "wh_main_grn_greenskins",
      "targetFaction": "wh3_main_grn_dark_land_orcs",
      "baseAttitude": null,
      "modifiers": [],
      "treaties": [],
      "atWar": false
    },
    {
      "sourceFaction": "wh_main_grn_greenskins",
      "targetFaction": "wh3_main_ogr_fulg",
      "baseAttitude": null,
      "modifiers": [],
      "treaties": [],
      "atWar": true
    },
    {
      "sourceFaction": "wh_dlc08_nor_wintertooth",
      "targetFaction": "wh3_main_ksl_druzhina_enclave",
      "baseAttitude": null,
      "modifiers": [],
      "treaties": [],
      "atWar": true
    },
    {
      "sourceFaction": "wh3_main_sla_subtle_torture",
      "targetFaction": "wh3_main_kho_crimson_skull",
      "baseAttitude": null,
      "modifiers": [],
      "treaties": [],
      "atWar": true
    },
    {
      "sourceFaction": "wh2_main_def_hag_graef",
      "targetFaction": "wh3_main_tze_broken_wheel",
      "baseAttitude": null,
      "modifiers": [],
      "treaties": [],
      "atWar": true
    },
    {
      "sourceFaction": "wh3_main_vmp_lahmian_sisterhood",
      "targetFaction": "wh3_main_grn_drippin_fangs",
      "baseAttitude": null,
      "modifiers": [],
      "treaties": [],
      "atWar": true
    },
    {
      "sourceFaction": "wh3_main_vmp_lahmian_sisterhood",
      "targetFaction": "wh2_dlc09_tmb_lybaras",
      "baseAttitude": null,
      "modifiers": [],
      "treaties": [],
      "atWar": true
    },
    {
      "sourceFaction": "wh3_dlc20_chs_valkia",
      "targetFaction": "wh2_main_def_ghrond",
      "baseAttitude": null,
      "modifiers": [],
      "treaties": [],
      "atWar": true
    },
    {
      "sourceFaction": "wh3_main_ksl_the_great_orthodoxy",
      "targetFaction": "wh3_main_wef_laurelorn",
      "baseAttitude": null,
      "modifiers": [],
      "treaties": [
        "non_aggression_pact"
      ],
      "atWar": false
    },
    {
      "sourceFaction": "wh3_main_ksl_the_great_orthodoxy",
      "targetFaction": "wh_main_emp_nordland",
      "baseAttitude": null,
      "modifiers": [],
      "treaties": [
        "non_aggression_pact"
      ],
      "atWar": false
    },
    {
      "sourceFaction": "wh3_main_ksl_the_great_orthodoxy",
      "targetFaction": "wh3_main_ksl_ungol_kindred",
      "baseAttitude": null,
      "modifiers": [],
      "treaties": [],
      "atWar": true
    },
    {
      "sourceFaction": "wh_dlc03_grn_black_pit",
      "targetFaction": "wh_main_emp_middenland",
      "baseAttitude": null,
      "modifiers": [],
      "treaties": [],
      "atWar": true
    },
    {
      "sourceFaction": "wh_main_emp_nordland",
      "targetFaction": "wh_main_emp_middenland",
      "baseAttitude": null,
      "modifiers": [],
      "treaties": [],
      "atWar": false
    },
    {
      "sourceFaction": "wh3_main_lzd_tepoks_spawn",
      "targetFaction": "wh2_dlc09_skv_clan_rictus",
      "baseAttitude": null,
      "modifiers": [],
      "treaties": [],
      "atWar": true
    },
    {
      "sourceFaction": "wh_main_teb_tilea",
      "targetFaction": "wh2_dlc11_cst_pirates_of_sartosa",
      "baseAttitude": null,
      "modifiers": [],
      "treaties": [],
      "atWar": true
    },
    {
      "sourceFaction": "wh3_dlc23_chd_astragoth",
      "targetFaction": "wh3_main_grn_slaves_of_zharr",
      "baseAttitude": null,
      "modifiers": [],
      "treaties": [],
      "atWar": true
    },
    {
      "sourceFaction": "wh3_dlc23_chd_astragoth",
      "targetFaction": "wh3_dlc23_chd_conclave",
      "baseAttitude": null,
      "modifiers": [],
      "treaties": [
        "military_access",
        "trade_agreement",
        "non_aggression_pact"
      ],
      "atWar": false
    },
    {
      "sourceFaction": "wh3_dlc23_chd_astragoth",
      "targetFaction": "wh3_dlc23_chd_legion_of_azgorh",
      "baseAttitude": null,
      "modifiers": [],
      "treaties": [],
      "atWar": false
    },
    {
      "sourceFaction": "wh2_dlc16_skv_clan_gritus",
      "targetFaction": "wh2_main_bst_manblight",
      "baseAttitude": null,
      "modifiers": [],
      "treaties": [],
      "atWar": true
    },
    {
      "sourceFaction": "wh_main_emp_empire",
      "targetFaction": "wh_main_emp_ostland",
      "baseAttitude": null,
      "modifiers": [],
      "treaties": [],
      "atWar": false
    },
    {
      "sourceFaction": "wh_main_emp_empire",
      "targetFaction": "wh_main_emp_middenland",
      "baseAttitude": null,
      "modifiers": [],
      "treaties": [],
      "atWar": false
    },
    {
      "sourceFaction": "wh_main_emp_empire",
      "targetFaction": "wh_main_emp_nordland",
      "baseAttitude": null,
      "modifiers": [],
      "treaties": [],
      "atWar": false
    },
    {
      "sourceFaction": "wh_main_emp_empire",
      "targetFaction": "wh_main_emp_averland",
      "baseAttitude": null,
      "modifiers": [],
      "treaties": [],
      "atWar": false
    },
    {
      "sourceFaction": "wh_main_emp_empire",
      "targetFaction": "wh_main_emp_wissenland",
      "baseAttitude": null,
      "modifiers": [],
      "treaties": [],
      "atWar": false
    },
    {
      "sourceFaction": "wh_main_emp_empire",
      "targetFaction": "wh_main_brt_bretonnia",
      "baseAttitude": null,
      "modifiers": [],
      "treaties": [
        "non_aggression_pact"
      ],
      "atWar": false
    },
    {
      "sourceFaction": "wh_main_emp_empire",
      "targetFaction": "wh_main_emp_ostermark",
      "baseAttitude": null,
      "modifiers": [],
      "treaties": [],
      "atWar": false
    },
    {
      "sourceFaction": "wh_main_emp_empire",
      "targetFaction": "wh_main_emp_empire_separatists",
      "baseAttitude": null,
      "modifiers": [],
      "treaties": [],
      "atWar": true
    },
    {
      "sourceFaction": "wh_main_emp_empire",